{
  "schemaVersion": 1,
  "packId": "world-seed",
  "version": "0.2.0",
  "validFrom": "2026-10-31",
  "validTo": null,
  "coverage": {
    "target": "full_ecosystem",
    "status": "partial",
    "notes": "Censo semilla ampliado para probar categorías, géneros, edades y confederaciones. No representa todavía todas las ligas existentes; el objetivo aprobado es ecosistema completo por paquetes verificables."
  },
  "competitions": [
    {
      "id": "na-boreal-men",
      "displayName": "Liga Boreal",
      "referenceName": "NBA",
      "country": "US",
      "confederation": "fiba-americas",
      "kind": "league",
      "level": "national",
      "gender": "men",
      "ageGroup": "senior",
      "category": "pro",
      "season": "2026-27",
      "teams": 30,
      "ruleSet": "NA-2026-27",
      "sourceStatus": "verified",
      "sourceUrl": "https://www.nba.com/news/nba-cup-101"
    },
    {
      "id": "na-boreal-development",
      "displayName": "Desarrollo Boreal",
      "referenceName": "NBA G League",
      "country": "US",
      "confederation": "fiba-americas",
      "kind": "league",
      "level": "national",
      "gender": "men",
      "ageGroup": "senior",
      "category": "pro",
      "season": "2026-27",
      "teams": 31,
      "ruleSet": "NA-2026-27",
      "sourceStatus": "verified",
      "sourceUrl": "https://gleague.nba.com/about"
    },
    {
      "id": "na-boreal-women",
      "displayName": "Liga Boreal Femenina",
      "referenceName": "WNBA",
      "country": "US",
      "confederation": "fiba-americas",
      "kind": "league",
      "level": "national",
      "gender": "women",
      "ageGroup": "senior",
      "category": "pro",
      "season": "2026",
      "teams": null,
      "ruleSet": "NA-W-2026",
      "sourceStatus": "pending",
      "sourceUrl": "https://www.wnba.com/"
    },
    {
      "id": "na-university-men",
      "displayName": "Liga Universitaria Boreal",
      "referenceName": "NCAA Division I Men",
      "country": "US",
      "confederation": "national",
      "kind": "league",
      "level": "national",
      "gender": "men",
      "ageGroup": "university",
      "category": "university",
      "season": "2026-27",
      "teams": null,
      "ruleSet": "NCAA-M-2026-27",
      "sourceStatus": "verified",
      "sourceUrl": "https://www.ncaa.com/news/basketball-men/article/2026-05-07/ncaa-reveals-new-76-team-bracket-di-mens-and-womens-basketball-championships"
    },
    {
      "id": "na-university-women",
      "displayName": "Liga Universitaria Boreal Femenina",
      "referenceName": "NCAA Division I Women",
      "country": "US",
      "confederation": "national",
      "kind": "league",
      "level": "national",
      "gender": "women",
      "ageGroup": "university",
      "category": "university",
      "season": "2026-27",
      "teams": null,
      "ruleSet": "NCAA-W-2026-27",
      "sourceStatus": "verified",
      "sourceUrl": "https://www.ncaa.com/news/basketball-men/article/2026-05-07/ncaa-reveals-new-76-team-bracket-di-mens-and-womens-basketball-championships"
    },
    {
      "id": "es-iberica-men",
      "displayName": "Liga Ibérica",
      "referenceName": "ACB Liga Endesa",
      "country": "ES",
      "confederation": "fiba-europe",
      "kind": "league",
      "level": "national",
      "gender": "men",
      "ageGroup": "senior",
      "category": "pro",
      "season": "2026-27",
      "teams": 18,
      "ruleSet": "FIBA-2026",
      "sourceStatus": "verified",
      "sourceUrl": "https://acb.com/es/liga/noticias/las-fechas-de-la-temporada-2026-27-145584"
    },
    {
      "id": "es-ascenso-iberico",
      "displayName": "Ascenso Ibérico",
      "referenceName": "Primera FEB",
      "country": "ES",
      "confederation": "fiba-europe",
      "kind": "league",
      "level": "national",
      "gender": "men",
      "ageGroup": "senior",
      "category": "pro",
      "season": "2026-27",
      "teams": 18,
      "ruleSet": "FIBA-2026",
      "sourceStatus": "verified",
      "sourceUrl": "https://www.feb.es/primerafeb/2026/5/30/baloncesto/las-ligas-feb-inician-ilusionante-campana-202627-asentando-sus-bases-asamblea-feb/104958.aspx"
    },
    {
      "id": "es-iberica-women",
      "displayName": "Liga Ibérica Femenina",
      "referenceName": "Liga Femenina Endesa",
      "country": "ES",
      "confederation": "fiba-europe",
      "kind": "league",
      "level": "national",
      "gender": "women",
      "ageGroup": "senior",
      "category": "pro",
      "season": "2026-27",
      "teams": 16,
      "ruleSet": "FIBA-2026",
      "sourceStatus": "verified",
      "sourceUrl": "https://www.feb.es/primerafeb/2026/5/30/baloncesto/las-ligas-feb-inician-ilusionante-campana-202627-asentando-sus-bases-asamblea-feb/104958.aspx"
    },
    {
      "id": "eu-elite",
      "displayName": "Liga Europea Élite",
      "referenceName": "EuroLeague",
      "country": "EU",
      "confederation": "fiba-europe",
      "kind": "league",
      "level": "continental",
      "gender": "men",
      "ageGroup": "senior",
      "category": "pro",
      "season": "2026-27",
      "teams": 20,
      "ruleSet": "FIBA-2026",
      "sourceStatus": "verified",
      "sourceUrl": "https://mediacentre.euroleague.net/en/app/2/communication/communication/preview/24407"
    },
    {
      "id": "au-pacific",
      "displayName": "Liga del Pacífico Sur",
      "referenceName": "NBL Australia",
      "country": "AU",
      "confederation": "fiba-oceania",
      "kind": "league",
      "level": "national",
      "gender": "men",
      "ageGroup": "senior",
      "category": "pro",
      "season": "2026-27",
      "teams": null,
      "ruleSet": "FIBA-2026",
      "sourceStatus": "pending",
      "sourceUrl": "https://nbl.com.au/"
    },
    {
      "id": "cn-dragon",
      "displayName": "Liga del Dragón",
      "referenceName": "CBA China",
      "country": "CN",
      "confederation": "fiba-asia",
      "kind": "league",
      "level": "national",
      "gender": "men",
      "ageGroup": "senior",
      "category": "pro",
      "season": "2026-27",
      "teams": null,
      "ruleSet": "FIBA-2026",
      "sourceStatus": "pending",
      "sourceUrl": "https://www.cbaleague.com/"
    },
    {
      "id": "jp-sun",
      "displayName": "Liga del Sol Naciente",
      "referenceName": "B.League Japan",
      "country": "JP",
      "confederation": "fiba-asia",
      "kind": "league",
      "level": "national",
      "gender": "men",
      "ageGroup": "senior",
      "category": "pro",
      "season": "2026-27",
      "teams": null,
      "ruleSet": "FIBA-2026",
      "sourceStatus": "pending",
      "sourceUrl": "https://www.bleague.jp/"
    },
    {
      "id": "es-bronce-iberico",
      "displayName": "Bronce Ibérico",
      "referenceName": "Segunda FEB",
      "country": "ES",
      "confederation": "fiba-europe",
      "kind": "league",
      "level": "national",
      "gender": "men",
      "ageGroup": "senior",
      "category": "semipro",
      "season": "2026-27",
      "teams": 28,
      "ruleSet": "FIBA-2026",
      "sourceStatus": "verified",
      "sourceUrl": "https://www.feb.es/primerafeb/2026/5/30/baloncesto/las-ligas-feb-inician-ilusionante-campana-202627-asentando-sus-bases-asamblea-feb/104958.aspx"
    },
    {
      "id": "es-iberica-women-2",
      "displayName": "Ascenso Ibérico Femenino",
      "referenceName": "Liga Femenina 2",
      "country": "ES",
      "confederation": "fiba-europe",
      "kind": "league",
      "level": "national",
      "gender": "women",
      "ageGroup": "senior",
      "category": "semipro",
      "season": "2026-27",
      "teams": null,
      "ruleSet": "FIBA-2026",
      "sourceStatus": "pending",
      "sourceUrl": "https://www.feb.es/"
    },
    {
      "id": "es-cantera-iberica",
      "displayName": "Cantera Ibérica",
      "referenceName": "Campeonato de España Junior FEB",
      "country": "ES",
      "confederation": "fiba-europe",
      "kind": "tournament",
      "level": "national",
      "gender": "men",
      "ageGroup": "u18",
      "category": "youth",
      "season": "2026-27",
      "teams": null,
      "ruleSet": "FIBA-2026",
      "sourceStatus": "pending",
      "sourceUrl": "https://www.feb.es/"
    },
    {
      "id": "eu-ascenso",
      "displayName": "Copa Europea de Ascenso",
      "referenceName": "EuroCup",
      "country": "EU",
      "confederation": "fiba-europe",
      "kind": "league",
      "level": "continental",
      "gender": "men",
      "ageGroup": "senior",
      "category": "pro",
      "season": "2026-27",
      "teams": null,
      "ruleSet": "FIBA-2026",
      "sourceStatus": "pending",
      "sourceUrl": "https://www.euroleaguebasketball.net/eurocup/"
    },
    {
      "id": "eu-campeones",
      "displayName": "Liga de Campeones Europea",
      "referenceName": "Basketball Champions League",
      "country": "EU",
      "confederation": "fiba-europe",
      "kind": "league",
      "level": "continental",
      "gender": "men",
      "ageGroup": "senior",
      "category": "pro",
      "season": "2026-27",
      "teams": null,
      "ruleSet": "FIBA-2026",
      "sourceStatus": "pending",
      "sourceUrl": "https://www.championsleague.basketball/"
    },
    {
      "id": "eu-copa-fiba",
      "displayName": "Copa FIBA Europa",
      "referenceName": "FIBA Europe Cup",
      "country": "EU",
      "confederation": "fiba-europe",
      "kind": "league",
      "level": "continental",
      "gender": "men",
      "ageGroup": "senior",
      "category": "pro",
      "season": "2026-27",
      "teams": null,
      "ruleSet": "FIBA-2026",
      "sourceStatus": "pending",
      "sourceUrl": "https://www.fiba.basketball/en/competitions/fiba-europe-cup"
    },
    {
      "id": "world-cup-men",
      "displayName": "Copa Mundial Boreal",
      "referenceName": "FIBA Basketball World Cup",
      "country": "WW",
      "confederation": "continental",